{
  "model": {
    "url": "{{env:MODEL_URL|http://test.com}}",
    "name": "{{env:MODEL_NAME|test}}",
    "auth": {
      "secret_ref": "{{env:MODEL_AUTH_SECRET_REF|test}}"
    }
  },
  "benchmarks": [
    {
      "id": "arc_easy",
      "provider_id": "gpu_test_provider",
      "parameters": {
        "num_examples": 10
      }
    }
  ],
  "name": "gpu-test-with-queue-v100-selector",
  "tags": ["gpu", "test", "scenario-2b", "kueue", "v100"],
  "queue": {
    "kind": "kueue",
    "name": "test-local-queue"
  }
}
